Job ID: 8215492
Start time: Mon Feb  9 18:59:45 CST 2026
Requirement already satisfied: torch>=1.9.0 in /projects/e32998/env/lib/python3.12/site-packages (from -r /projects/e32998/STAT390_Winter2026/Team3/Code/sofie_task10/requirements.txt (line 2)) (2.9.0)
Requirement already satisfied: torchvision>=0.10.0 in /projects/e32998/env/lib/python3.12/site-packages (from -r /projects/e32998/STAT390_Winter2026/Team3/Code/sofie_task10/requirements.txt (line 3)) (0.24.0)
Requirement already satisfied: numpy>=1.21.0 in /projects/e32998/env/lib/python3.12/site-packages (from -r /projects/e32998/STAT390_Winter2026/Team3/Code/sofie_task10/requirements.txt (line 4)) (2.3.4)
Requirement already satisfied: pandas>=1.3.0 in /projects/e32998/env/lib/python3.12/site-packages (from -r /projects/e32998/STAT390_Winter2026/Team3/Code/sofie_task10/requirements.txt (line 5)) (2.3.3)
Requirement already satisfied: scikit-learn>=1.0.0 in /projects/e32998/env/lib/python3.12/site-packages (from -r /projects/e32998/STAT390_Winter2026/Team3/Code/sofie_task10/requirements.txt (line 6)) (1.7.2)
Requirement already satisfied: Pillow>=8.3.0 in /projects/e32998/env/lib/python3.12/site-packages (from -r /projects/e32998/STAT390_Winter2026/Team3/Code/sofie_task10/requirements.txt (line 7)) (12.0.0)
Requirement already satisfied: tqdm>=4.62.0 in /projects/e32998/env/lib/python3.12/site-packages (from -r /projects/e32998/STAT390_Winter2026/Team3/Code/sofie_task10/requirements.txt (line 8)) (4.67.1)
Requirement already satisfied: matplotlib>=3.5.0 in /projects/e32998/env/lib/python3.12/site-packages (from -r /projects/e32998/STAT390_Winter2026/Team3/Code/sofie_task10/requirements.txt (line 11)) (3.10.7)
Requirement already satisfied: seaborn>=0.11.0 in /projects/e32998/env/lib/python3.12/site-packages (from -r /projects/e32998/STAT390_Winter2026/Team3/Code/sofie_task10/requirements.txt (line 12)) (0.13.2)
Requirement already satisfied: psutil>=5.8.0 in /projects/e32998/env/lib/python3.12/site-packages (from -r /projects/e32998/STAT390_Winter2026/Team3/Code/sofie_task10/requirements.txt (line 15)) (7.1.2)
Requirement already satisfied: imbalanced-learn>=0.8.0 in /projects/e32998/env/lib/python3.12/site-packages (from -r /projects/e32998/STAT390_Winter2026/Team3/Code/sofie_task10/requirements.txt (line 18)) (0.14.0)
Requirement already satisfied: optuna>=3.0.0 in /projects/e32998/env/lib/python3.12/site-packages (from -r /projects/e32998/STAT390_Winter2026/Team3/Code/sofie_task10/requirements.txt (line 22)) (4.7.0)
Requirement already satisfied: plotly>=5.0.0 in /projects/e32998/env/lib/python3.12/site-packages (from -r /projects/e32998/STAT390_Winter2026/Team3/Code/sofie_task10/requirements.txt (line 24)) (6.5.2)
Requirement already satisfied: kaleido>=0.2.0 in /projects/e32998/env/lib/python3.12/site-packages (from -r /projects/e32998/STAT390_Winter2026/Team3/Code/sofie_task10/requirements.txt (line 25)) (1.2.0)
Requirement already satisfied: filelock in /projects/e32998/env/lib/python3.12/site-packages (from torch>=1.9.0->-r /projects/e32998/STAT390_Winter2026/Team3/Code/sofie_task10/requirements.txt (line 2)) (3.20.0)
Requirement already satisfied: typing-extensions>=4.10.0 in /projects/e32998/env/lib/python3.12/site-packages (from torch>=1.9.0->-r /projects/e32998/STAT390_Winter2026/Team3/Code/sofie_task10/requirements.txt (line 2)) (4.15.0)
Requirement already satisfied: setuptools in /projects/e32998/env/lib/python3.12/site-packages (from torch>=1.9.0->-r /projects/e32998/STAT390_Winter2026/Team3/Code/sofie_task10/requirements.txt (line 2)) (80.9.0)
Requirement already satisfied: sympy>=1.13.3 in /projects/e32998/env/lib/python3.12/site-packages (from torch>=1.9.0->-r /projects/e32998/STAT390_Winter2026/Team3/Code/sofie_task10/requirements.txt (line 2)) (1.14.0)
Requirement already satisfied: networkx>=2.5.1 in /projects/e32998/env/lib/python3.12/site-packages (from torch>=1.9.0->-r /projects/e32998/STAT390_Winter2026/Team3/Code/sofie_task10/requirements.txt (line 2)) (3.5)
Requirement already satisfied: jinja2 in /projects/e32998/env/lib/python3.12/site-packages (from torch>=1.9.0->-r /projects/e32998/STAT390_Winter2026/Team3/Code/sofie_task10/requirements.txt (line 2)) (3.1.6)
Requirement already satisfied: fsspec>=0.8.5 in /projects/e32998/env/lib/python3.12/site-packages (from torch>=1.9.0->-r /projects/e32998/STAT390_Winter2026/Team3/Code/sofie_task10/requirements.txt (line 2)) (2025.9.0)
Requirement already satisfied: nvidia-cuda-nvrtc-cu12==12.8.93 in /projects/e32998/env/lib/python3.12/site-packages (from torch>=1.9.0->-r /projects/e32998/STAT390_Winter2026/Team3/Code/sofie_task10/requirements.txt (line 2)) (12.8.93)
Requirement already satisfied: nvidia-cuda-runtime-cu12==12.8.90 in /projects/e32998/env/lib/python3.12/site-packages (from torch>=1.9.0->-r /projects/e32998/STAT390_Winter2026/Team3/Code/sofie_task10/requirements.txt (line 2)) (12.8.90)
Requirement already satisfied: nvidia-cuda-cupti-cu12==12.8.90 in /projects/e32998/env/lib/python3.12/site-packages (from torch>=1.9.0->-r /projects/e32998/STAT390_Winter2026/Team3/Code/sofie_task10/requirements.txt (line 2)) (12.8.90)
Requirement already satisfied: nvidia-cudnn-cu12==9.10.2.21 in /projects/e32998/env/lib/python3.12/site-packages (from torch>=1.9.0->-r /projects/e32998/STAT390_Winter2026/Team3/Code/sofie_task10/requirements.txt (line 2)) (9.10.2.21)
Requirement already satisfied: nvidia-cublas-cu12==12.8.4.1 in /projects/e32998/env/lib/python3.12/site-packages (from torch>=1.9.0->-r /projects/e32998/STAT390_Winter2026/Team3/Code/sofie_task10/requirements.txt (line 2)) (12.8.4.1)
Requirement already satisfied: nvidia-cufft-cu12==11.3.3.83 in /projects/e32998/env/lib/python3.12/site-packages (from torch>=1.9.0->-r /projects/e32998/STAT390_Winter2026/Team3/Code/sofie_task10/requirements.txt (line 2)) (11.3.3.83)
Requirement already satisfied: nvidia-curand-cu12==10.3.9.90 in /projects/e32998/env/lib/python3.12/site-packages (from torch>=1.9.0->-r /projects/e32998/STAT390_Winter2026/Team3/Code/sofie_task10/requirements.txt (line 2)) (10.3.9.90)
Requirement already satisfied: nvidia-cusolver-cu12==11.7.3.90 in /projects/e32998/env/lib/python3.12/site-packages (from torch>=1.9.0->-r /projects/e32998/STAT390_Winter2026/Team3/Code/sofie_task10/requirements.txt (line 2)) (11.7.3.90)
Requirement already satisfied: nvidia-cusparse-cu12==12.5.8.93 in /projects/e32998/env/lib/python3.12/site-packages (from torch>=1.9.0->-r /projects/e32998/STAT390_Winter2026/Team3/Code/sofie_task10/requirements.txt (line 2)) (12.5.8.93)
Requirement already satisfied: nvidia-cusparselt-cu12==0.7.1 in /projects/e32998/env/lib/python3.12/site-packages (from torch>=1.9.0->-r /projects/e32998/STAT390_Winter2026/Team3/Code/sofie_task10/requirements.txt (line 2)) (0.7.1)
Requirement already satisfied: nvidia-nccl-cu12==2.27.5 in /projects/e32998/env/lib/python3.12/site-packages (from torch>=1.9.0->-r /projects/e32998/STAT390_Winter2026/Team3/Code/sofie_task10/requirements.txt (line 2)) (2.27.5)
Requirement already satisfied: nvidia-nvshmem-cu12==3.3.20 in /projects/e32998/env/lib/python3.12/site-packages (from torch>=1.9.0->-r /projects/e32998/STAT390_Winter2026/Team3/Code/sofie_task10/requirements.txt (line 2)) (3.3.20)
Requirement already satisfied: nvidia-nvtx-cu12==12.8.90 in /projects/e32998/env/lib/python3.12/site-packages (from torch>=1.9.0->-r /projects/e32998/STAT390_Winter2026/Team3/Code/sofie_task10/requirements.txt (line 2)) (12.8.90)
Requirement already satisfied: nvidia-nvjitlink-cu12==12.8.93 in /projects/e32998/env/lib/python3.12/site-packages (from torch>=1.9.0->-r /projects/e32998/STAT390_Winter2026/Team3/Code/sofie_task10/requirements.txt (line 2)) (12.8.93)
Requirement already satisfied: nvidia-cufile-cu12==1.13.1.3 in /projects/e32998/env/lib/python3.12/site-packages (from torch>=1.9.0->-r /projects/e32998/STAT390_Winter2026/Team3/Code/sofie_task10/requirements.txt (line 2)) (1.13.1.3)
Requirement already satisfied: triton==3.5.0 in /projects/e32998/env/lib/python3.12/site-packages (from torch>=1.9.0->-r /projects/e32998/STAT390_Winter2026/Team3/Code/sofie_task10/requirements.txt (line 2)) (3.5.0)
Requirement already satisfied: python-dateutil>=2.8.2 in /projects/e32998/env/lib/python3.12/site-packages (from pandas>=1.3.0->-r /projects/e32998/STAT390_Winter2026/Team3/Code/sofie_task10/requirements.txt (line 5)) (2.9.0.post0)
Requirement already satisfied: pytz>=2020.1 in /projects/e32998/env/lib/python3.12/site-packages (from pandas>=1.3.0->-r /projects/e32998/STAT390_Winter2026/Team3/Code/sofie_task10/requirements.txt (line 5)) (2025.2)
Requirement already satisfied: tzdata>=2022.7 in /projects/e32998/env/lib/python3.12/site-packages (from pandas>=1.3.0->-r /projects/e32998/STAT390_Winter2026/Team3/Code/sofie_task10/requirements.txt (line 5)) (2025.2)
Requirement already satisfied: scipy>=1.8.0 in /projects/e32998/env/lib/python3.12/site-packages (from scikit-learn>=1.0.0->-r /projects/e32998/STAT390_Winter2026/Team3/Code/sofie_task10/requirements.txt (line 6)) (1.16.3)
Requirement already satisfied: joblib>=1.2.0 in /projects/e32998/env/lib/python3.12/site-packages (from scikit-learn>=1.0.0->-r /projects/e32998/STAT390_Winter2026/Team3/Code/sofie_task10/requirements.txt (line 6)) (1.5.2)
Requirement already satisfied: threadpoolctl>=3.1.0 in /projects/e32998/env/lib/python3.12/site-packages (from scikit-learn>=1.0.0->-r /projects/e32998/STAT390_Winter2026/Team3/Code/sofie_task10/requirements.txt (line 6)) (3.6.0)
Requirement already satisfied: contourpy>=1.0.1 in /projects/e32998/env/lib/python3.12/site-packages (from matplotlib>=3.5.0->-r /projects/e32998/STAT390_Winter2026/Team3/Code/sofie_task10/requirements.txt (line 11)) (1.3.3)
Requirement already satisfied: cycler>=0.10 in /projects/e32998/env/lib/python3.12/site-packages (from matplotlib>=3.5.0->-r /projects/e32998/STAT390_Winter2026/Team3/Code/sofie_task10/requirements.txt (line 11)) (0.12.1)
Requirement already satisfied: fonttools>=4.22.0 in /projects/e32998/env/lib/python3.12/site-packages (from matplotlib>=3.5.0->-r /projects/e32998/STAT390_Winter2026/Team3/Code/sofie_task10/requirements.txt (line 11)) (4.60.1)
Requirement already satisfied: kiwisolver>=1.3.1 in /projects/e32998/env/lib/python3.12/site-packages (from matplotlib>=3.5.0->-r /projects/e32998/STAT390_Winter2026/Team3/Code/sofie_task10/requirements.txt (line 11)) (1.4.9)
Requirement already satisfied: packaging>=20.0 in /projects/e32998/env/lib/python3.12/site-packages (from matplotlib>=3.5.0->-r /projects/e32998/STAT390_Winter2026/Team3/Code/sofie_task10/requirements.txt (line 11)) (25.0)
Requirement already satisfied: pyparsing>=3 in /projects/e32998/env/lib/python3.12/site-packages (from matplotlib>=3.5.0->-r /projects/e32998/STAT390_Winter2026/Team3/Code/sofie_task10/requirements.txt (line 11)) (3.2.5)
Requirement already satisfied: alembic>=1.5.0 in /projects/e32998/env/lib/python3.12/site-packages (from optuna>=3.0.0->-r /projects/e32998/STAT390_Winter2026/Team3/Code/sofie_task10/requirements.txt (line 22)) (1.18.3)
Requirement already satisfied: colorlog in /projects/e32998/env/lib/python3.12/site-packages (from optuna>=3.0.0->-r /projects/e32998/STAT390_Winter2026/Team3/Code/sofie_task10/requirements.txt (line 22)) (6.10.1)
Requirement already satisfied: sqlalchemy>=1.4.2 in /projects/e32998/env/lib/python3.12/site-packages (from optuna>=3.0.0->-r /projects/e32998/STAT390_Winter2026/Team3/Code/sofie_task10/requirements.txt (line 22)) (2.0.46)
Requirement already satisfied: PyYAML in /projects/e32998/env/lib/python3.12/site-packages (from optuna>=3.0.0->-r /projects/e32998/STAT390_Winter2026/Team3/Code/sofie_task10/requirements.txt (line 22)) (6.0.3)
Requirement already satisfied: narwhals>=1.15.1 in /projects/e32998/env/lib/python3.12/site-packages (from plotly>=5.0.0->-r /projects/e32998/STAT390_Winter2026/Team3/Code/sofie_task10/requirements.txt (line 24)) (2.16.0)
Requirement already satisfied: choreographer>=1.1.1 in /projects/e32998/env/lib/python3.12/site-packages (from kaleido>=0.2.0->-r /projects/e32998/STAT390_Winter2026/Team3/Code/sofie_task10/requirements.txt (line 25)) (1.2.1)
Requirement already satisfied: logistro>=1.0.8 in /projects/e32998/env/lib/python3.12/site-packages (from kaleido>=0.2.0->-r /projects/e32998/STAT390_Winter2026/Team3/Code/sofie_task10/requirements.txt (line 25)) (2.0.1)
Requirement already satisfied: orjson>=3.10.15 in /projects/e32998/env/lib/python3.12/site-packages (from kaleido>=0.2.0->-r /projects/e32998/STAT390_Winter2026/Team3/Code/sofie_task10/requirements.txt (line 25)) (3.11.7)
Requirement already satisfied: pytest-timeout>=2.4.0 in /projects/e32998/env/lib/python3.12/site-packages (from kaleido>=0.2.0->-r /projects/e32998/STAT390_Winter2026/Team3/Code/sofie_task10/requirements.txt (line 25)) (2.4.0)
Requirement already satisfied: Mako in /projects/e32998/env/lib/python3.12/site-packages (from alembic>=1.5.0->optuna>=3.0.0->-r /projects/e32998/STAT390_Winter2026/Team3/Code/sofie_task10/requirements.txt (line 22)) (1.3.10)
Requirement already satisfied: simplejson>=3.19.3 in /projects/e32998/env/lib/python3.12/site-packages (from choreographer>=1.1.1->kaleido>=0.2.0->-r /projects/e32998/STAT390_Winter2026/Team3/Code/sofie_task10/requirements.txt (line 25)) (3.20.2)
Requirement already satisfied: pytest>=7.0.0 in /projects/e32998/env/lib/python3.12/site-packages (from pytest-timeout>=2.4.0->kaleido>=0.2.0->-r /projects/e32998/STAT390_Winter2026/Team3/Code/sofie_task10/requirements.txt (line 25)) (9.0.2)
Requirement already satisfied: iniconfig>=1.0.1 in /projects/e32998/env/lib/python3.12/site-packages (from pytest>=7.0.0->pytest-timeout>=2.4.0->kaleido>=0.2.0->-r /projects/e32998/STAT390_Winter2026/Team3/Code/sofie_task10/requirements.txt (line 25)) (2.3.0)
Requirement already satisfied: pluggy<2,>=1.5 in /projects/e32998/env/lib/python3.12/site-packages (from pytest>=7.0.0->pytest-timeout>=2.4.0->kaleido>=0.2.0->-r /projects/e32998/STAT390_Winter2026/Team3/Code/sofie_task10/requirements.txt (line 25)) (1.6.0)
Requirement already satisfied: pygments>=2.7.2 in /projects/e32998/env/lib/python3.12/site-packages (from pytest>=7.0.0->pytest-timeout>=2.4.0->kaleido>=0.2.0->-r /projects/e32998/STAT390_Winter2026/Team3/Code/sofie_task10/requirements.txt (line 25)) (2.19.2)
Requirement already satisfied: six>=1.5 in /projects/e32998/env/lib/python3.12/site-packages (from python-dateutil>=2.8.2->pandas>=1.3.0->-r /projects/e32998/STAT390_Winter2026/Team3/Code/sofie_task10/requirements.txt (line 5)) (1.17.0)
Requirement already satisfied: greenlet>=1 in /projects/e32998/env/lib/python3.12/site-packages (from sqlalchemy>=1.4.2->optuna>=3.0.0->-r /projects/e32998/STAT390_Winter2026/Team3/Code/sofie_task10/requirements.txt (line 22)) (3.3.1)
Requirement already satisfied: mpmath<1.4,>=1.1.0 in /projects/e32998/env/lib/python3.12/site-packages (from sympy>=1.13.3->torch>=1.9.0->-r /projects/e32998/STAT390_Winter2026/Team3/Code/sofie_task10/requirements.txt (line 2)) (1.3.0)
Requirement already satisfied: MarkupSafe>=2.0 in /projects/e32998/env/lib/python3.12/site-packages (from jinja2->torch>=1.9.0->-r /projects/e32998/STAT390_Winter2026/Team3/Code/sofie_task10/requirements.txt (line 2)) (3.0.3)
Requirement already satisfied: certifi in /projects/e32998/env/lib/python3.12/site-packages (2026.1.4)
==================================
Starting Hyperparameter Optimization
==================================
Using CPU
============================================================
PREPARING DATA FOR HYPERPARAMETER TUNING
============================================================
Loaded 105 labels
Found 83595 patch files
All 3808 non-standard file names were handled.
Grouped into 378 slices
Mapped 366 slices to classes
Class distribution: {0: 128, 1: 238}
Loading existing splits from: /projects/e32998/STAT390_Winter2026/Team3/Code/data_splits/data_splits_01.npz
Data splits loaded from: /projects/e32998/STAT390_Winter2026/Team3/Code/data_splits/data_splits_01.npz
Split sizes - Train: 222, Val: 72, Test: 68
Cases per split: 50 17 18
Paths per split: 47679 15631 16166
No leakage between train & val (cases).
No leakage between train & test (cases).
No leakage between val & test (cases).
No leakage between train & val (paths).
No leakage between train & test (paths).
No leakage between val & test (paths).

================================================================================
STARTING BAYESIAN HYPERPARAMETER OPTIMIZATION
Study name: mil_tuning_20260209_185954
Number of trials: 20
================================================================================


============================================================
Trial 0: {'embed_dim': 512, 'dropout': 0.1624074561769746, 'learning_rate': 2.0511104188433963e-05, 'weight_decay': 1.493656855461763e-06, 'batch_size': 1, 'class_weight_benign': 4.46470458309974, 'per_slice_cap': 200, 'max_slices_per_stain': None, 'use_scheduler': True, 'scheduler_type': 'cosine', 'scheduler_factor': 0.3557975442608167, 'scheduler_patience': 3, 'early_stopping': True, 'early_stopping_patience': 7}
============================================================

Random seed set to 42
Epoch 1/10 - Train Loss: 0.7058, Val Loss: 0.6394, Val Acc: 0.7059
Epoch 2/10 - Train Loss: 0.6741, Val Loss: 0.6220, Val Acc: 0.7059
Epoch 3/10 - Train Loss: 0.6648, Val Loss: 0.6177, Val Acc: 0.7059
Epoch 4/10 - Train Loss: 0.6273, Val Loss: 0.6160, Val Acc: 0.7059
Epoch 5/10 - Train Loss: 0.6695, Val Loss: 0.6062, Val Acc: 0.7059
Epoch 6/10 - Train Loss: 0.6228, Val Loss: 0.6155, Val Acc: 0.7059
Epoch 7/10 - Train Loss: 0.6346, Val Loss: 0.6161, Val Acc: 0.7059
Epoch 8/10 - Train Loss: 0.6294, Val Loss: 0.6098, Val Acc: 0.7059
Epoch 9/10 - Train Loss: 0.6193, Val Loss: 0.6063, Val Acc: 0.7059
Epoch 10/10 - Train Loss: 0.6131, Val Loss: 0.6095, Val Acc: 0.7059
[I 2026-02-09 21:19:24,237] Trial 0 finished with value: 0.6062347643515643 and parameters: {'embed_dim': 512, 'dropout': 0.1624074561769746, 'learning_rate': 2.0511104188433963e-05, 'weight_decay': 1.493656855461763e-06, 'batch_size': 1, 'class_weight_benign': 4.46470458309974, 'per_slice_cap': 200, 'max_slices_per_stain': None, 'use_scheduler': True, 'scheduler_type': 'cosine', 'scheduler_factor': 0.3557975442608167, 'scheduler_patience': 3, 'early_stopping': True, 'early_stopping_patience': 7}. Best is trial 0 with value: 0.6062347643515643.

============================================================
Trial 1: {'embed_dim': 512, 'dropout': 0.33696582754481696, 'learning_rate': 1.2385137298860926e-05, 'weight_decay': 6.647135865318028e-05, 'batch_size': 1, 'class_weight_benign': 1.6820964947491661, 'per_slice_cap': 150, 'max_slices_per_stain': 10, 'use_scheduler': True, 'scheduler_type': 'reduce_on_plateau', 'scheduler_factor': 0.5650089137415928, 'scheduler_patience': 3, 'early_stopping': True, 'early_stopping_patience': 8}
============================================================

Random seed set to 43
Epoch 1/10 - Train Loss: 0.7215, Val Loss: 0.6377, Val Acc: 0.7059
Epoch 2/10 - Train Loss: 0.6563, Val Loss: 0.6248, Val Acc: 0.7059
Epoch 3/10 - Train Loss: 0.6389, Val Loss: 0.6229, Val Acc: 0.7059
Epoch 4/10 - Train Loss: 0.6603, Val Loss: 0.6170, Val Acc: 0.7059
Epoch 5/10 - Train Loss: 0.6586, Val Loss: 0.6188, Val Acc: 0.7059
Epoch 6/10 - Train Loss: 0.6687, Val Loss: 0.6168, Val Acc: 0.7059
Epoch 7/10 - Train Loss: 0.6577, Val Loss: 0.6093, Val Acc: 0.7059
Epoch 8/10 - Train Loss: 0.6469, Val Loss: 0.6078, Val Acc: 0.7059
Epoch 9/10 - Train Loss: 0.6395, Val Loss: 0.6029, Val Acc: 0.7059
Epoch 10/10 - Train Loss: 0.6320, Val Loss: 0.6081, Val Acc: 0.7059
[I 2026-02-09 23:20:41,003] Trial 1 finished with value: 0.6028685525936239 and parameters: {'embed_dim': 512, 'dropout': 0.33696582754481696, 'learning_rate': 1.2385137298860926e-05, 'weight_decay': 6.647135865318028e-05, 'batch_size': 1, 'class_weight_benign': 1.6820964947491661, 'per_slice_cap': 150, 'max_slices_per_stain': 10, 'use_scheduler': True, 'scheduler_type': 'reduce_on_plateau', 'scheduler_factor': 0.5650089137415928, 'scheduler_patience': 3, 'early_stopping': True, 'early_stopping_patience': 8}. Best is trial 1 with value: 0.6028685525936239.

============================================================
Trial 2: {'embed_dim': 768, 'dropout': 0.4757995766256756, 'learning_rate': 0.0006161049539380963, 'weight_decay': 6.218704727769077e-05, 'batch_size': 1, 'class_weight_benign': 4.687496940092467, 'per_slice_cap': 200, 'max_slices_per_stain': 10, 'use_scheduler': True, 'scheduler_type': 'reduce_on_plateau', 'scheduler_factor': 0.6947547746402069, 'scheduler_patience': 5, 'early_stopping': True, 'early_stopping_patience': 6}
============================================================

Random seed set to 44
Epoch 1/10 - Train Loss: 2.1472, Val Loss: 1.0452, Val Acc: 0.5882
Epoch 2/10 - Train Loss: 0.9340, Val Loss: 1.0540, Val Acc: 0.7059
Epoch 3/10 - Train Loss: 1.1253, Val Loss: 0.7993, Val Acc: 0.5882
Epoch 4/10 - Train Loss: 1.2128, Val Loss: 0.8036, Val Acc: 0.6471
Epoch 5/10 - Train Loss: 0.8600, Val Loss: 0.9371, Val Acc: 0.4706
Epoch 6/10 - Train Loss: 0.7524, Val Loss: 1.1106, Val Acc: 0.5294
Epoch 7/10 - Train Loss: 0.9686, Val Loss: 1.1300, Val Acc: 0.7059
Epoch 8/10 - Train Loss: 0.8102, Val Loss: 1.0880, Val Acc: 0.2941
Early stopping at epoch 8
