[I 2026-02-10 01:16:18,591] Trial 2 finished with value: 0.7992928735911846 and parameters: {'embed_dim': 768, 'dropout': 0.4757995766256756, 'learning_rate': 0.0006161049539380963, 'weight_decay': 6.218704727769077e-05, 'batch_size': 1, 'class_weight_benign': 4.687496940092467, 'per_slice_cap': 200, 'max_slices_per_stain': 10, 'use_scheduler': True, 'scheduler_type': 'reduce_on_plateau', 'scheduler_factor': 0.6947547746402069, 'scheduler_patience': 5, 'early_stopping': True, 'early_stopping_patience': 6}. Best is trial 1 with value: 0.6028685525936239.

============================================================
Trial 3: {'embed_dim': 512, 'dropout': 0.4085081386743783, 'learning_rate': 1.4063366777718176e-05, 'weight_decay': 1.1895896737553539e-05, 'batch_size': 1, 'class_weight_benign': 1.4634762381005189, 'per_slice_cap': 50, 'max_slices_per_stain': 20, 'use_scheduler': True, 'scheduler_type': 'cosine', 'scheduler_factor': 0.5245108790277985, 'scheduler_patience': 5, 'early_stopping': True, 'early_stopping_patience': 7}
============================================================

Random seed set to 45
Epoch 1/10 - Train Loss: 0.6812, Val Loss: 0.5984, Val Acc: 0.7059
Epoch 2/10 - Train Loss: 0.6453, Val Loss: 0.6066, Val Acc: 0.7059
Epoch 3/10 - Train Loss: 0.6798, Val Loss: 0.5922, Val Acc: 0.7059
Epoch 4/10 - Train Loss: 0.6371, Val Loss: 0.5844, Val Acc: 0.7059
Epoch 5/10 - Train Loss: 0.6437, Val Loss: 0.5832, Val Acc: 0.7059
Epoch 6/10 - Train Loss: 0.6498, Val Loss: 0.5869, Val Acc: 0.7059
Epoch 7/10 - Train Loss: 0.6831, Val Loss: 0.5894, Val Acc: 0.7059
Epoch 8/10 - Train Loss: 0.6372, Val Loss: 0.5876, Val Acc: 0.7059
Epoch 9/10 - Train Loss: 0.6413, Val Loss: 0.5780, Val Acc: 0.7059
Epoch 10/10 - Train Loss: 0.6347, Val Loss: 0.5951, Val Acc: 0.7059
[I 2026-02-10 02:26:28,999] Trial 3 finished with value: 0.5779720912961399 and parameters: {'embed_dim': 512, 'dropout': 0.4085081386743783, 'learning_rate': 1.4063366777718176e-05, 'weight_decay': 1.1895896737553539e-05, 'batch_size': 1, 'class_weight_benign': 1.4634762381005189, 'per_slice_cap': 50, 'max_slices_per_stain': 20, 'use_scheduler': True, 'scheduler_type': 'cosine', 'scheduler_factor': 0.5245108790277985, 'scheduler_patience': 5, 'early_stopping': True, 'early_stopping_patience': 7}. Best is trial 3 with value: 0.5779720912961399.

============================================================
Trial 4: {'embed_dim': 256, 'dropout': 0.11257167427469371, 'learning_rate': 0.000187422109855557, 'weight_decay': 8.771380343280564e-06, 'batch_size': 1, 'class_weight_benign': 3.034282764658811, 'per_slice_cap': 50, 'max_slices_per_stain': 20, 'use_scheduler': True, 'scheduler_type': 'reduce_on_plateau', 'scheduler_factor': 0.3746280235544143, 'scheduler_patience': 5, 'early_stopping': True, 'early_stopping_patience': 8}
============================================================

Random seed set to 46
Epoch 1/10 - Train Loss: 0.7780, Val Loss: 0.5797, Val Acc: 0.7059
Epoch 2/10 - Train Loss: 0.7023, Val Loss: 0.6771, Val Acc: 0.7059
Epoch 3/10 - Train Loss: 0.6306, Val Loss: 0.6473, Val Acc: 0.7059
Epoch 4/10 - Train Loss: 0.6682, Val Loss: 0.5627, Val Acc: 0.7059
Epoch 5/10 - Train Loss: 0.6259, Val Loss: 0.6034, Val Acc: 0.7059
Epoch 6/10 - Train Loss: 0.6326, Val Loss: 0.5788, Val Acc: 0.7059
Epoch 7/10 - Train Loss: 0.6255, Val Loss: 0.7960, Val Acc: 0.7059
Epoch 8/10 - Train Loss: 0.5615, Val Loss: 0.8276, Val Acc: 0.7059
Epoch 9/10 - Train Loss: 0.5920, Val Loss: 0.9724, Val Acc: 0.7059
Epoch 10/10 - Train Loss: 0.4806, Val Loss: 0.7951, Val Acc: 0.7059
[I 2026-02-10 03:41:06,955] Trial 4 finished with value: 0.5626955856295193 and parameters: {'embed_dim': 256, 'dropout': 0.11257167427469371, 'learning_rate': 0.000187422109855557, 'weight_decay': 8.771380343280564e-06, 'batch_size': 1, 'class_weight_benign': 3.034282764658811, 'per_slice_cap': 50, 'max_slices_per_stain': 20, 'use_scheduler': True, 'scheduler_type': 'reduce_on_plateau', 'scheduler_factor': 0.3746280235544143, 'scheduler_patience': 5, 'early_stopping': True, 'early_stopping_patience': 8}. Best is trial 4 with value: 0.5626955856295193.

============================================================
Trial 5: {'embed_dim': 512, 'dropout': 0.1911740650167767, 'learning_rate': 7.148510793512978e-05, 'weight_decay': 0.00028447512555118193, 'batch_size': 1, 'class_weight_benign': 4.442922333025374, 'per_slice_cap': 100, 'max_slices_per_stain': 10, 'use_scheduler': True, 'scheduler_type': 'reduce_on_plateau', 'scheduler_factor': 0.40071291833014566, 'scheduler_patience': 3, 'early_stopping': True, 'early_stopping_patience': 6}
============================================================

Random seed set to 47
Epoch 1/10 - Train Loss: 0.6757, Val Loss: 0.5679, Val Acc: 0.7647
Epoch 2/10 - Train Loss: 0.7061, Val Loss: 0.5890, Val Acc: 0.7647
Epoch 3/10 - Train Loss: 0.7056, Val Loss: 0.5975, Val Acc: 0.9412
Epoch 4/10 - Train Loss: 0.6883, Val Loss: 0.5126, Val Acc: 0.8235
Epoch 5/10 - Train Loss: 0.6045, Val Loss: 0.7008, Val Acc: 0.7059
Epoch 6/10 - Train Loss: 0.6534, Val Loss: 0.5439, Val Acc: 0.7059
Epoch 7/10 - Train Loss: 0.6005, Val Loss: 0.5141, Val Acc: 0.8235
Epoch 8/10 - Train Loss: 0.6124, Val Loss: 0.4480, Val Acc: 0.8824
Epoch 9/10 - Train Loss: 0.5100, Val Loss: 0.4723, Val Acc: 0.8235
Epoch 10/10 - Train Loss: 0.4865, Val Loss: 0.6035, Val Acc: 0.7647
[I 2026-02-10 05:12:35,172] Trial 5 finished with value: 0.448001392185688 and parameters: {'embed_dim': 512, 'dropout': 0.1911740650167767, 'learning_rate': 7.148510793512978e-05, 'weight_decay': 0.00028447512555118193, 'batch_size': 1, 'class_weight_benign': 4.442922333025374, 'per_slice_cap': 100, 'max_slices_per_stain': 10, 'use_scheduler': True, 'scheduler_type': 'reduce_on_plateau', 'scheduler_factor': 0.40071291833014566, 'scheduler_patience': 3, 'early_stopping': True, 'early_stopping_patience': 6}. Best is trial 5 with value: 0.448001392185688.

============================================================
Trial 6: {'embed_dim': 768, 'dropout': 0.12059150049999574, 'learning_rate': 3.608219327363783e-05, 'weight_decay': 0.0005306371575220846, 'batch_size': 1, 'class_weight_benign': 1.9582475626678897, 'per_slice_cap': 150, 'max_slices_per_stain': 5, 'use_scheduler': False, 'scheduler_type': 'reduce_on_plateau', 'scheduler_factor': 0.6341209982356951, 'scheduler_patience': 3, 'early_stopping': True, 'early_stopping_patience': 6}
============================================================

Random seed set to 48
Epoch 1/10 - Train Loss: 0.6938, Val Loss: 0.6111, Val Acc: 0.7059
Epoch 2/10 - Train Loss: 0.6698, Val Loss: 0.6328, Val Acc: 0.7059
Epoch 3/10 - Train Loss: 0.6625, Val Loss: 0.6045, Val Acc: 0.7059
Epoch 4/10 - Train Loss: 0.6437, Val Loss: 0.7037, Val Acc: 0.7059
Epoch 5/10 - Train Loss: 0.6507, Val Loss: 0.6001, Val Acc: 0.7059
Epoch 6/10 - Train Loss: 0.5977, Val Loss: 0.5621, Val Acc: 0.7059
Epoch 7/10 - Train Loss: 0.6487, Val Loss: 0.6988, Val Acc: 0.7059
Epoch 8/10 - Train Loss: 0.6209, Val Loss: 0.6646, Val Acc: 0.7059
Epoch 9/10 - Train Loss: 0.5298, Val Loss: 0.5980, Val Acc: 0.7059
Epoch 10/10 - Train Loss: 0.4744, Val Loss: 0.6100, Val Acc: 0.7059
[I 2026-02-10 06:48:31,299] Trial 6 finished with value: 0.5621187292477664 and parameters: {'embed_dim': 768, 'dropout': 0.12059150049999574, 'learning_rate': 3.608219327363783e-05, 'weight_decay': 0.0005306371575220846, 'batch_size': 1, 'class_weight_benign': 1.9582475626678897, 'per_slice_cap': 150, 'max_slices_per_stain': 5, 'use_scheduler': False, 'scheduler_type': 'reduce_on_plateau', 'scheduler_factor': 0.6341209982356951, 'scheduler_patience': 3, 'early_stopping': True, 'early_stopping_patience': 6}. Best is trial 5 with value: 0.448001392185688.

============================================================
Trial 7: {'embed_dim': 768, 'dropout': 0.3048372233197124, 'learning_rate': 2.8378638146176247e-05, 'weight_decay': 8.62022042601805e-05, 'batch_size': 1, 'class_weight_benign': 1.6974657160199658, 'per_slice_cap': 150, 'max_slices_per_stain': 10, 'use_scheduler': False, 'scheduler_type': 'reduce_on_plateau', 'scheduler_factor': 0.39674091636018066, 'scheduler_patience': 2, 'early_stopping': True, 'early_stopping_patience': 10}
============================================================

Random seed set to 49
Epoch 1/10 - Train Loss: 0.6715, Val Loss: 0.5989, Val Acc: 0.7059
Epoch 2/10 - Train Loss: 0.6349, Val Loss: 0.6192, Val Acc: 0.7059
Epoch 3/10 - Train Loss: 0.6827, Val Loss: 0.5822, Val Acc: 0.7059
Epoch 4/10 - Train Loss: 0.6321, Val Loss: 0.5585, Val Acc: 0.7059
Epoch 5/10 - Train Loss: 0.6742, Val Loss: 0.5933, Val Acc: 0.7059
Epoch 6/10 - Train Loss: 0.6798, Val Loss: 0.6207, Val Acc: 0.8824
Epoch 7/10 - Train Loss: 0.6510, Val Loss: 0.5208, Val Acc: 0.7059
Epoch 8/10 - Train Loss: 0.6129, Val Loss: 0.5155, Val Acc: 0.7059
Epoch 9/10 - Train Loss: 0.6103, Val Loss: 0.5675, Val Acc: 0.8824
Epoch 10/10 - Train Loss: 0.6142, Val Loss: 0.5011, Val Acc: 0.8235
[I 2026-02-10 08:36:36,419] Trial 7 finished with value: 0.5011415358851937 and parameters: {'embed_dim': 768, 'dropout': 0.3048372233197124, 'learning_rate': 2.8378638146176247e-05, 'weight_decay': 8.62022042601805e-05, 'batch_size': 1, 'class_weight_benign': 1.6974657160199658, 'per_slice_cap': 150, 'max_slices_per_stain': 10, 'use_scheduler': False, 'scheduler_type': 'reduce_on_plateau', 'scheduler_factor': 0.39674091636018066, 'scheduler_patience': 2, 'early_stopping': True, 'early_stopping_patience': 10}. Best is trial 5 with value: 0.448001392185688.

============================================================
Trial 8: {'embed_dim': 256, 'dropout': 0.3903822715480958, 'learning_rate': 0.000622616348236346, 'weight_decay': 0.00045841547801363794, 'batch_size': 1, 'class_weight_benign': 4.1195021834304955, 'per_slice_cap': 200, 'max_slices_per_stain': 15, 'use_scheduler': False, 'scheduler_type': 'reduce_on_plateau', 'scheduler_factor': 0.3897077237842239, 'scheduler_patience': 4, 'early_stopping': True, 'early_stopping_patience': 6}
============================================================

Random seed set to 50
Epoch 1/10 - Train Loss: 0.9332, Val Loss: 0.6107, Val Acc: 0.7059
Epoch 2/10 - Train Loss: 0.8092, Val Loss: 0.6150, Val Acc: 0.7059
Epoch 3/10 - Train Loss: 0.7553, Val Loss: 0.6994, Val Acc: 0.7059
Epoch 4/10 - Train Loss: 0.7829, Val Loss: 0.8392, Val Acc: 0.7059
Epoch 5/10 - Train Loss: 0.8517, Val Loss: 0.8642, Val Acc: 0.7059
Epoch 6/10 - Train Loss: 0.6662, Val Loss: 0.5715, Val Acc: 0.7059
